{"$schema":"https://json-schema.org/draft/2020-12/schema","additionalProperties":false,"properties":{"active_from_utc":{"pattern":"^[0-9]{4}-[0-9]{2}-[0-9]{2}T[0-9]{2}:[0-9]{2}:[0-9]{2}Z$","type":"string"},"artifact_kind":{"const":"subject-development-mission-v5-proof"},"authorization_id":{"pattern":"^[0-9a-f]{64}$","type":"string"},"authorization_schema_sha256":{"pattern":"^[0-9a-f]{64}$","type":"string"},"authorization_verifier_sha256":{"pattern":"^[0-9a-f]{64}$","type":"string"},"authorizing_principal":{"const":"github:zycaskevin"},"baseline_full_digest":{"pattern":"^[0-9a-f]{64}$","type":"string"},"baseline_id":{"pattern":"^[0-9a-f]{16}$","type":"string"},"contract_sha256":{"pattern":"^[0-9a-f]{64}$","type":"string"},"expires_at_utc":{"pattern":"^[0-9]{4}-[0-9]{2}-[0-9]{2}T[0-9]{2}:[0-9]{2}:[0-9]{2}Z$","type":"string"},"issued_at_utc":{"pattern":"^[0-9]{4}-[0-9]{2}-[0-9]{2}T[0-9]{2}:[0-9]{2}:[0-9]{2}Z$","type":"string"},"mission_duration_seconds":{"const":7776000,"type":"integer"},"mission_id":{"pattern":"^[0-9a-f]{64}$","type":"string"},"mission_not_after_utc":{"pattern":"^[0-9]{4}-[0-9]{2}-[0-9]{2}T[0-9]{2}:[0-9]{2}:[0-9]{2}Z$","type":"string"},"mission_proof_path":{"const":"specs/subject-distillation/task-authorizations/MISSION-V5-T004-T033.json"},"owner_confirmation_ref":{"maxLength":128,"minLength":1,"pattern":"^[A-Za-z0-9][A-Za-z0-9._:-]*$","type":"string"},"progress_sequence":{"const":6,"type":"integer"},"progress_sha256":{"pattern":"^[0-9a-f]{64}$","type":"string"},"proposal_id":{"pattern":"^[0-9a-f]{64}$","type":"string"},"protocol_base_commit":{"pattern":"^git:[0-9a-f]{40}$","type":"string"},"protocol_decision_id":{"const":"SD-MISSION-V5-POST-START-CI-RECOVERY"},"receipt_sha256":{"pattern":"^[0-9a-f]{64}$","type":"string"},"recorded_at_utc":{"pattern":"^[0-9]{4}-[0-9]{2}-[0-9]{2}T[0-9]{2}:[0-9]{2}:[0-9]{2}Z$","type":"string"},"repository":{"const":"zycaskevin/Vault-Agent-Memory"},"schema_version":{"const":5,"type":"integer"},"scope_registry_sha256":{"pattern":"^[0-9a-f]{64}$","type":"string"},"scope_sha256":{"pattern":"^[0-9a-f]{64}$","type":"string"},"status":{"const":"PASS"},"supersession_sha256":{"pattern":"^[0-9a-f]{64}$","type":"string"},"tasks_sha256":{"pattern":"^[0-9a-f]{64}$","type":"string"},"trust_root":{"items":{"additionalProperties":false,"properties":{"path":{"maxLength":256,"minLength":1,"type":"string"},"sha256":{"pattern":"^[0-9a-f]{64}$","type":"string"}},"required":["path","sha256"],"type":"object"},"type":"array"},"trust_root_sha256":{"pattern":"^[0-9a-f]{64}$","type":"string"}},"required":["schema_version","artifact_kind","status","repository","authorizing_principal","protocol_decision_id","protocol_base_commit","baseline_id","baseline_full_digest","tasks_sha256","contract_sha256","scope_registry_sha256","supersession_sha256","trust_root","trust_root_sha256","progress_sequence","progress_sha256","issued_at_utc","expires_at_utc","mission_duration_seconds","proposal_id","receipt_sha256","scope_sha256","authorization_id","authorization_verifier_sha256","authorization_schema_sha256","mission_proof_path","recorded_at_utc","active_from_utc","mission_not_after_utc","owner_confirmation_ref","mission_id"],"type":"object"}
