{"active_from_utc":"2026-08-14T16:15:07Z","artifact_kind":"subject-development-mission-v5-proof","authorization_id":"94d3db3e009a0f877cdbd3dbd5408a53f511dc60a66bdea52091aeb7f5d888a1","authorization_schema_sha256":"73ebc733f482a06b4ba77e507869597a2bc0b5e3ba6eca3ca969d7796d6170fe","authorization_verifier_sha256":"fd233f32a5f7afe506276fc92aae0d77a6144a0537e8b9b8f25cf300b22cdbe3","authorizing_principal":"github:zycaskevin","baseline_full_digest":"0dc10cfc4a429662037f3bb7d6c42e10e7cc832b540f7aa8f4b9e0656e0e459b","baseline_id":"0dc10cfc4a429662","contract_sha256":"9dfb66e13fb5a43841a0894e0e91e014c7ef714889c2342a5e62d98deb7b2467","expires_at_utc":"2026-08-14T16:27:21Z","issued_at_utc":"2026-08-14T16:12:21Z","mission_duration_seconds":7776000,"mission_id":"a35fdb429b98aa5cdb51ec4f969e39208326f8486e00524c3c79e1f3ed35f415","mission_not_after_utc":"2026-11-12T16:15:07Z","mission_proof_path":"specs/subject-distillation/task-authorizations/MISSION-V5-T004-T033.json","owner_confirmation_ref":"owner-message:d4c94c001fa2d04f","progress_sequence":6,"progress_sha256":"28478445e3eeb5b838b010fa81518d4fcbbb5c6a37422cb3aa58dabdcbf87626","proposal_id":"d4c94c001fa2d04f6a0b8e04c9ed32befae5b47f6994ef6da40e092c6d7a7933","protocol_base_commit":"git:cd8e722a4fa88698d50796edbb407f8ea3a42c41","protocol_decision_id":"SD-MISSION-V5-POST-START-CI-RECOVERY","receipt_sha256":"64ffeeefe611b0c12c12d7caec3753f95a140ff5a8edd982602fab53beda91ec","recorded_at_utc":"2026-08-14T16:15:07Z","repository":"zycaskevin/Vault-Agent-Memory","schema_version":5,"scope_registry_sha256":"c2d55591e677f923981fa6dc242c47d98cd0e13fb43a844f8cf9b5a9060dd1db","scope_sha256":"4865e06239365cebbf6e6773437394649c5932de416e3abeb1d68a0fbeed5714","status":"PASS","supersession_sha256":"615890be6e1533be5526339fbaabaf12c6e10460b1002381792b4233fbf8d933","tasks_sha256":"0150935a1a16e51dc30dff9dff8d01104d7127ee3cf57333caec7586d93f5007","trust_root":[{"path":".github/workflows/ci.yml","sha256":"c60be53e30af73c942fedd6b67336aaa12a56fd067c86461735e836f25a1ae91"},{"path":"docs/decision_records/2026-08-14-subject-development-mission-v5-recovery.md","sha256":"84ef6b33f18bc3f02a4c8576a5e2f76b0a7f0ce3a7afd8299b46f704b416acd4"},{"path":"scripts/run_subject_development_mission_v5.py","sha256":"86a76900bf772ccc43a446b12d43ee9a8b2b3a74d10a0ad3e8e584dd9a9fcdf9"},{"path":"scripts/update_subject_task_progress_v5.py","sha256":"64d10f43f4a92ae1ca047e1516e93d4c5b0c0b78098601889e9152e240df365c"},{"path":"scripts/validate_subject_development_mission_v5.py","sha256":"d79bf1ee1268e2fc8a0cbaafb6f9abec9e5057643dc4c1dcb34b4db68446737e"},{"path":"scripts/validate_subject_task_authorization_dispatch_v5.py","sha256":"a70e365e5691981b4d19a80929667c50014800e77f04bdf825296e6ead953c58"},{"path":"specs/subject-distillation/development-mission-v5.contract.json","sha256":"9dfb66e13fb5a43841a0894e0e91e014c7ef714889c2342a5e62d98deb7b2467"},{"path":"specs/subject-distillation/development-mission-v5.schema.json","sha256":"9146ee58d8ff5a82dbec41bb7da94564b09c32a163645a4c47b0f761e1de3406"},{"path":"specs/subject-distillation/development-missions/README.md","sha256":"48ab486c3326f1903c625bb9b1fa162c3a44ea3fdd120c63777f636b13a657e4"},{"path":"specs/subject-distillation/task-scope-manifest-v5.json","sha256":"c2d55591e677f923981fa6dc242c47d98cd0e13fb43a844f8cf9b5a9060dd1db"}],"trust_root_sha256":"d7d6386fa180ca2034859a79f3fd506deffc8b628937e6a1a7d2b7b6a4ef21e8"}
